{
  "schema_version": "1.0",
  "receipt_id": "2026-06-30-null-create-call-receipt-schema-and-fable-to-hermes-harness-integration-plan",
  "created_at": "2026-06-30T02:49:57Z",
  "agent_id": "null",
  "task": "Create call receipt schema and Fable-to-Hermes harness integration plan",
  "status": "completed_with_receipt",
  "artifact_refs": [
    "/Users/rentamac/nous-package/schemas/call-receipt.schema.json",
    "/Users/rentamac/nous-package/examples/simulated-call-receipt.json",
    "/Users/rentamac/agent-comms/research/fable-claude-code-to-hermes-harness-plan-2026-06-30.md"
  ],
  "verification": {
    "checks_passed": [
      "Call receipt schema written for future telephony/voice approval gates",
      "Simulated example written without placing any phone call",
      "Harness plan written with clean-room boundary: no leaked Claude Code source copied"
    ],
    "checks_failed": [],
    "unverified_claims": [
      "No live telephony provider configured or tested",
      "No Hermes codebase plugin implemented yet; this is an architecture plan"
    ],
    "confidence": "high"
  },
  "promotion_gate": "submit_after_human_review"
}
