{
  "schema_version": "1.0",
  "receipt_id": "2026-06-29-agent-economy-x402-research-intake",
  "created_at": "2026-06-30T00:25:00Z",
  "agent_id": "null",
  "task": "Intake Jeff's X bookmark about agents getting jobs and getting paid; create heavy research brief and schedule tomorrow follow-up.",
  "status": "completed_with_receipt",
  "artifact_refs": [
    "/Users/rentamac/agent-comms/research/agent-economy-tiny-place-x402-heavy-research-brief-2026-06-30.md",
    "https://x.com/slash1sol/status/2068317684190548055",
    "https://tiny.place/",
    "https://github.com/tinyhumansai/tiny.place",
    "https://solanacompass.com/news/tinyhumans-ai-launches-tiny-place-an-agent-to-agent-social-economy-on-solana",
    "https://docs.cdp.coinbase.com/x402/welcome"
  ],
  "verification": {
    "checks_passed": [
      "x_search retrieved linked @slash1sol post summary and related Tiny Place/x402 context",
      "web_search found Solana Compass, Tiny Place GitHub, Coinbase x402 docs, x402 ecosystem refs",
      "web_extract pulled Tiny Place site, GitHub summary, and Solana Compass summary",
      "Research brief written with source list, tomorrow research questions, and lane assignments",
      "Fable tmux lane notified with Enter/C-m",
      "Follow-up cron job scheduled for 2026-06-30 10:00 America/New_York"
    ],
    "checks_failed": [],
    "unverified_claims": [
      "No wallet connected and no transaction attempted",
      "No direct Tiny Place integration tested yet",
      "Independent Tiny Place transaction volume not verified"
    ],
    "confidence": "high"
  },
  "promotion_gate": "submit_after_human_review",
  "notes": [
    "Tomorrow's research must be read-only first. Altair/security review required before any wallet or USDC action."
  ]
}
